{
  "$schema": "https://json-schema.org/draft/2020-12/schema",
  "$id": "https://omni-folio.local/contracts/benchmark-index-series.v1.schema.json",
  "title": "Owner-declared normalized benchmark index series v1",
  "description": "One immutable complete version, not raw security quotes. Runtime additionally requires UTF-8, unique JSON keys, canonical UTC, strictly increasing points no later than fetched_at, byte bounds, canonical decimals and a query/fragment/credential-free HTTPS provenance reference. Storage verification is not provider verification or data redistribution permission. Input and canonical JSON are each limited to 1 MiB.",
  "type": "object",
  "additionalProperties": false,
  "required": [
    "schema_version",
    "benchmark_id",
    "label",
    "currency",
    "return_basis",
    "source_reference",
    "source_version",
    "sample",
    "fetched_at",
    "points"
  ],
  "properties": {
    "schema_version": {
      "const": "benchmark-index-series.v1"
    },
    "benchmark_id": {
      "$ref": "#/$defs/identity"
    },
    "label": {
      "type": "string",
      "minLength": 1,
      "maxLength": 160,
      "description": "At most 160 UTF-8 bytes, trimmed and without control characters."
    },
    "currency": {
      "enum": [
        "KRW",
        "USD"
      ]
    },
    "return_basis": {
      "enum": [
        "price_index",
        "gross_total_return",
        "net_total_return"
      ]
    },
    "source_reference": {
      "type": "string",
      "minLength": 9,
      "maxLength": 512,
      "pattern": "^https://",
      "description": "At most 512 UTF-8 bytes. Public provenance reference only; never fetched by this command. No credentials, query or fragment."
    },
    "source_version": {
      "$ref": "#/$defs/identity",
      "description": "Owner file version; not a provider-verified revision or lexical freshness order. fetched_at is part of this version payload."
    },
    "sample": {
      "type": "boolean"
    },
    "fetched_at": {
      "$ref": "#/$defs/timestamp"
    },
    "points": {
      "type": "array",
      "minItems": 1,
      "maxItems": 10000,
      "items": {
        "type": "object",
        "additionalProperties": false,
        "required": [
          "observed_at",
          "level"
        ],
        "properties": {
          "observed_at": {
            "$ref": "#/$defs/timestamp"
          },
          "level": {
            "type": "string",
            "minLength": 1,
            "maxLength": 64,
            "pattern": "^(0|[1-9][0-9]*)(\\.[0-9]*[1-9])?$",
            "description": "Exact nonnegative canonical decimal using the existing core decimal contract; zero is allowed and is not a valid future comparison denominator."
          }
        }
      }
    }
  },
  "$defs": {
    "identity": {
      "type": "string",
      "minLength": 1,
      "maxLength": 128,
      "pattern": "^[^\\s\\u0000-\\u001f\\u007f]+$",
      "description": "At most 128 UTF-8 bytes; no Unicode whitespace or control characters."
    },
    "timestamp": {
      "type": "string",
      "minLength": 20,
      "maxLength": 30,
      "pattern": "^[0-9]{4}-[0-9]{2}-[0-9]{2}T[0-9]{2}:[0-9]{2}:[0-9]{2}(\\.[0-9]{0,8}[1-9])?Z$",
      "description": "Canonical UTC RFC3339Nano; invalid dates and redundant fractional zeroes are rejected."
    }
  }
}
